{
  "v": "ACDC10JSON00044b_",
  "d": "ED_jB_CgaoUrmd7d9Ln3gcq0ArsvOCs0EkGJpH_ubnhU",
  "i": "EC4SuEyzrRwu3FWFrK0Ubd9xejlo5bUwAtGcbBGUk2nL",
  "ri": "EM2YZ78SKE8eO4W1lQOJeer5xKZqLmJV7SPr3Ji5DMBZ",
  "s": "EF1f9-7xwdba4L3b2OsnhUMWb02NyXJAYJ34RrAFkHs8",
  "a": {
    "d": "EFM0s2YlM32LAh0h77tvkz3OR6AaYmHcVchm9oVNkvbI",
    "u": "0ADY50r_UJ3OaDC9ww7UcwXM",
    "dt": "2025-03-01T14:22:00.000000+00:00",
    "art_digest": "EK2r6EnDXre2pecTBO8s99j4OtNaaDIhVyr7uGugDhmp",
    "art_posture": "witness",
    "rev_latency": 0,
    "content_type": "image/jpeg",
    "content_size": 2847392,
    "content_location": [
      "https://evidence.example.org/artifacts/crash-scene-photo-01.jpg",
      "https://backup.example.org/artifacts/crash-scene-photo-01.jpg"
    ],
    "filename": "crash-scene-photo-01.SAID:EK2r6EnDXre2pecTBO8s99j4OtNaaDIhVyr7uGugDhmp.jpg",
    "description": "Photograph of the intersection of Main St and 5th Ave taken from the northwest corner, showing vehicle positions immediately after the collision.",
    "provenance": "Captured by traffic camera AID EC4SuEyzrRwu3FWFrK0Ubd9xejlo5bUwAtGcbBGUk2nL at 2025-03-01T14:19:43Z and downloaded by the insurance adjustor at 2025-03-01T14:22:00Z."
  }
}